InvoiceNo,Unnamed: 0,StockCode,Description,Quantity,InvoiceDate,UnitPrice,CustomerID,Country
536542,1425,22382,LUNCH BAG SPACEBOY DESIGN ,10,12/1/2010 14:11,1.65,16456.0,United Kingdom
536542,1426,20727,LUNCH BAG  BLACK SKULL.,10,12/1/2010 14:11,1.65,16456.0,United Kingdom
536542,1427,22383,LUNCH BAG SUKI  DESIGN ,20,12/1/2010 14:11,1.65,16456.0,United Kingdom
536542,1428,22386,JUMBO BAG PINK POLKADOT,30,12/1/2010 14:11,1.95,16456.0,United Kingdom
536542,1429,85099B,JUMBO BAG RED RETROSPOT,40,12/1/2010 14:11,1.95,16456.0,United Kingdom
536542,1430,22379,RECYCLING BAG RETROSPOT ,20,12/1/2010 14:11,2.1,16456.0,United Kingdom
536542,1431,20712,JUMBO BAG WOODLAND ANIMALS,20,12/1/2010 14:11,1.95,16456.0,United Kingdom
536542,1432,85099F,JUMBO BAG STRAWBERRY,30,12/1/2010 14:11,1.95,16456.0,United Kingdom
536542,1433,85099C,JUMBO  BAG BAROQUE BLACK WHITE,20,12/1/2010 14:11,1.95,16456.0,United Kingdom
536542,1434,21930,JUMBO STORAGE BAG SKULLS,20,12/1/2010 14:11,1.95,16456.0,United Kingdom
536542,1435,21928,JUMBO BAG SCANDINAVIAN PAISLEY,20,12/1/2010 14:11,1.95,16456.0,United Kingdom
536542,1436,22411,JUMBO SHOPPER VINTAGE RED PAISLEY,30,12/1/2010 14:11,1.95,16456.0,United Kingdom
536542,1437,21931,JUMBO STORAGE BAG SUKI,40,12/1/2010 14:11,1.95,16456.0,United Kingdom
536542,1438,20711,JUMBO BAG TOYS ,20,12/1/2010 14:11,1.95,16456.0,United Kingdom
536542,1439,20713,JUMBO BAG OWLS,30,12/1/2010 14:11,1.95,16456.0,United Kingdom
536542,1440,85123A,WHITE HANGING HEART T-LIGHT HOLDER,32,12/1/2010 14:11,2.95,16456.0,United Kingdom
C536543,1441,22632,HAND WARMER RED RETROSPOT,1,12/1/2010 14:30,2.1,17841.0,United Kingdom
C536543,1442,22355,CHARLOTTE BAG SUKI DESIGN,2,12/1/2010 14:30,0.85,17841.0,United Kingdom
536544,1443,21773,DECORATIVE ROSE BATHROOM BOTTLE,1,12/1/2010 14:32,2.51,,United Kingdom
536544,1444,21774,DECORATIVE CATS BATHROOM BOTTLE,2,12/1/2010 14:32,2.51,,United Kingdom
536544,1445,21786,POLKADOT RAIN HAT ,4,12/1/2010 14:32,0.85,,United Kingdom
536544,1446,21787,RAIN PONCHO RETROSPOT,2,12/1/2010 14:32,1.66,,United Kingdom
536544,1447,21790,VINTAGE SNAP CARDS,9,12/1/2010 14:32,1.66,,United Kingdom
536544,1448,21791,VINTAGE HEADS AND TAILS CARD GAME ,2,12/1/2010 14:32,2.51,,United Kingdom
536544,1449,21801,CHRISTMAS TREE DECORATION WITH BELL,10,12/1/2010 14:32,0.43,,United Kingdom
536544,1450,21802,CHRISTMAS TREE HEART DECORATION,9,12/1/2010 14:32,0.43,,United Kingdom
536544,1451,21803,CHRISTMAS TREE STAR DECORATION,11,12/1/2010 14:32,0.43,,United Kingdom
536544,1452,21809,CHRISTMAS HANGING TREE WITH BELL,1,12/1/2010 14:32,2.51,,United Kingdom
536544,1453,21810,CHRISTMAS HANGING STAR WITH BELL,3,12/1/2010 14:32,2.51,,United Kingdom
536544,1454,21811,CHRISTMAS HANGING HEART WITH BELL,1,12/1/2010 14:32,2.51,,United Kingdom
536544,1455,21821,GLITTER STAR GARLAND WITH BELLS ,1,12/1/2010 14:32,7.62,,United Kingdom
536544,1456,21822,GLITTER CHRISTMAS TREE WITH BELLS,1,12/1/2010 14:32,4.21,,United Kingdom
536544,1457,21823,PAINTED METAL HEART WITH HOLLY BELL,2,12/1/2010 14:32,2.98,,United Kingdom
536544,1458,21844,RED RETROSPOT MUG,2,12/1/2010 14:32,5.91,,United Kingdom
536544,1459,21851,LILAC DIAMANTE PEN IN GIFT BOX,1,12/1/2010 14:32,4.21,,United Kingdom
536544,1460,21870,I CAN ONLY PLEASE ONE PERSON MUG,1,12/1/2010 14:32,3.36,,United Kingdom
536544,1461,21871,SAVE THE PLANET MUG,5,12/1/2010 14:32,3.36,,United Kingdom
536544,1462,21874,GIN AND TONIC MUG,1,12/1/2010 14:32,3.36,,United Kingdom
536544,1463,21879,HEARTS GIFT TAPE,1,12/1/2010 14:32,1.66,,United Kingdom
536544,1464,21884,CAKES AND BOWS GIFT  TAPE,1,12/1/2010 14:32,1.66,,United Kingdom
536544,1465,21888,BINGO SET,1,12/1/2010 14:32,7.62,,United Kingdom
536544,1466,21889,WOODEN BOX OF DOMINOES,2,12/1/2010 14:32,2.51,,United Kingdom
536544,1467,21892,TRADITIONAL WOODEN CATCH CUP GAME ,3,12/1/2010 14:32,2.51,,United Kingdom
536544,1468,21894,POTTING SHED SEED ENVELOPES,1,12/1/2010 14:32,2.51,,United Kingdom
536544,1469,21911,GARDEN METAL SIGN ,1,12/1/2010 14:32,3.36,,United Kingdom
536544,1470,21912,VINTAGE SNAKES & LADDERS,3,12/1/2010 14:32,7.62,,United Kingdom
536544,1471,21913,VINTAGE SEASIDE JIGSAW PUZZLES,1,12/1/2010 14:32,7.62,,United Kingdom
536544,1472,21914,BLUE HARMONICA IN BOX ,3,12/1/2010 14:32,2.51,,United Kingdom
536544,1473,21915,RED  HARMONICA IN BOX ,2,12/1/2010 14:32,2.51,,United Kingdom
536544,1474,21922,UNION STRIPE WITH FRINGE  HAMMOCK,2,12/1/2010 14:32,16.98,,United Kingdom
536544,1475,21928,JUMBO BAG SCANDINAVIAN PAISLEY,1,12/1/2010 14:32,4.21,,United Kingdom
536544,1476,21935,SUKI  SHOULDER BAG,1,12/1/2010 14:32,3.36,,United Kingdom
536544,1477,21942,SKULLS DESIGN FLANNEL,2,12/1/2010 14:32,1.66,,United Kingdom
536544,1478,21944,KITTENS DESIGN FLANNEL,1,12/1/2010 14:32,1.66,,United Kingdom
536544,1479,21949,SET OF 6 STRAWBERRY CHOPSTICKS,1,12/1/2010 14:32,2.51,,United Kingdom
536544,1480,21975,PACK OF 60 DINOSAUR CAKE CASES,1,12/1/2010 14:32,1.28,,United Kingdom
536544,1481,21977,PACK OF 60 PINK PAISLEY CAKE CASES,1,12/1/2010 14:32,1.28,,United Kingdom
536544,1482,21982,PACK OF 12 SUKI TISSUES ,1,12/1/2010 14:32,0.85,,United Kingdom
536544,1483,21990,MODERN FLORAL STATIONERY SET,2,12/1/2010 14:32,2.51,,United Kingdom
536544,1484,21991,BOHEMIAN COLLAGE STATIONERY SET,1,12/1/2010 14:32,2.51,,United Kingdom
536544,1485,21992,VINTAGE PAISLEY STATIONERY SET,6,12/1/2010 14:32,2.51,,United Kingdom
536544,1486,21993,FLORAL FOLK STATIONERY SET,4,12/1/2010 14:32,2.51,,United Kingdom
536544,1487,22037,ROBOT BIRTHDAY CARD,1,12/1/2010 14:32,0.85,,United Kingdom
536544,1488,22043,CHRISTMAS CARD SCREEN PRINT ,1,12/1/2010 14:32,0.43,,United Kingdom
536544,1489,22064,PINK DOUGHNUT TRINKET POT ,1,12/1/2010 14:32,3.36,,United Kingdom
536544,1490,22065,CHRISTMAS PUDDING TRINKET POT ,1,12/1/2010 14:32,3.36,,United Kingdom
536544,1491,22067,CHOC TRUFFLE GOLD TRINKET POT ,1,12/1/2010 14:32,3.36,,United Kingdom
536544,1492,22068,BLACK PIRATE TREASURE CHEST,1,12/1/2010 14:32,3.36,,United Kingdom
536544,1493,22069,BROWN  PIRATE TREASURE CHEST ,1,12/1/2010 14:32,3.36,,United Kingdom
536544,1494,22071,SMALL WHITE RETROSPOT MUG IN BOX ,1,12/1/2010 14:32,7.62,,United Kingdom
536544,1495,22075,6 RIBBONS ELEGANT CHRISTMAS ,1,12/1/2010 14:32,3.36,,United Kingdom
536544,1496,22076,6 RIBBONS EMPIRE  ,1,12/1/2010 14:32,3.36,,United Kingdom
536544,1497,22077,6 RIBBONS RUSTIC CHARM,3,12/1/2010 14:32,3.36,,United Kingdom
536544,1498,22080,RIBBON REEL POLKADOTS ,1,12/1/2010 14:32,3.36,,United Kingdom
536544,1499,22081,RIBBON REEL FLORA + FAUNA ,1,12/1/2010 14:32,3.36,,United Kingdom
536544,1500,22082,RIBBON REEL STRIPES DESIGN ,1,12/1/2010 14:32,3.36,,United Kingdom
536544,1501,22083,PAPER CHAIN KIT RETROSPOT,4,12/1/2010 14:32,5.91,,United Kingdom
536544,1502,22086,PAPER CHAIN KIT 50'S CHRISTMAS ,33,12/1/2010 14:32,5.91,,United Kingdom
536544,1503,22087,PAPER BUNTING WHITE LACE,2,12/1/2010 14:32,5.91,,United Kingdom
536544,1504,22090,PAPER BUNTING RETROSPOT,1,12/1/2010 14:32,5.91,,United Kingdom
536544,1505,22095,LADS ONLY TISSUE BOX,2,12/1/2010 14:32,2.51,,United Kingdom
536544,1506,22100,SKULLS SQUARE TISSUE BOX,1,12/1/2010 14:32,2.51,,United Kingdom
536544,1507,22107,PIZZA PLATE IN BOX,1,12/1/2010 14:32,7.62,,United Kingdom
536544,1508,22110,BIRD HOUSE HOT WATER BOTTLE,2,12/1/2010 14:32,7.62,,United Kingdom
536544,1509,22111,SCOTTIE DOG HOT WATER BOTTLE,2,12/1/2010 14:32,11.02,,United Kingdom
536544,1510,22112,CHOCOLATE HOT WATER BOTTLE,2,12/1/2010 14:32,11.02,,United Kingdom
536544,1511,22114,HOT WATER BOTTLE TEA AND SYMPATHY,3,12/1/2010 14:32,8.47,,United Kingdom
536544,1512,22115,METAL SIGN EMPIRE TEA,2,12/1/2010 14:32,5.91,,United Kingdom
536544,1513,22130,PARTY CONE CHRISTMAS DECORATION ,2,12/1/2010 14:32,8.47,,United Kingdom
536544,1514,22134,LADLE LOVE HEART RED ,1,12/1/2010 14:32,0.85,,United Kingdom
536544,1515,22135,LADLE LOVE HEART PINK,5,12/1/2010 14:32,0.85,,United Kingdom
536544,1516,22141,CHRISTMAS CRAFT TREE TOP ANGEL,4,12/1/2010 14:32,4.21,,United Kingdom
536544,1517,22144,CHRISTMAS CRAFT LITTLE FRIENDS,4,12/1/2010 14:32,4.21,,United Kingdom
536544,1518,22149,FELTCRAFT 6 FLOWER FRIENDS,1,12/1/2010 14:32,4.21,,United Kingdom
536544,1519,22153,ANGEL DECORATION STARS ON DRESS,1,12/1/2010 14:32,0.85,,United Kingdom
536544,1520,22154,ANGEL DECORATION 3 BUTTONS ,1,12/1/2010 14:32,0.85,,United Kingdom
536544,1521,22155,STAR DECORATION RUSTIC,3,12/1/2010 14:32,0.85,,United Kingdom
536544,1522,22156,HEART DECORATION WITH PEARLS ,3,12/1/2010 14:32,1.66,,United Kingdom
536544,1523,22161,HEART DECORATION RUSTIC HANGING ,10,12/1/2010 14:32,0.81,,United Kingdom
536544,1524,22162,HEART GARLAND RUSTIC PADDED,2,12/1/2010 14:32,3.36,,United Kingdom
536544,1525,22169,FAMILY ALBUM WHITE PICTURE FRAME,1,12/1/2010 14:32,16.98,,United Kingdom
536544,1526,22174,PHOTO CUBE,2,12/1/2010 14:32,3.36,,United Kingdom
536544,1527,22178,VICTORIAN GLASS HANGING T-LIGHT,13,12/1/2010 14:32,2.51,,United Kingdom
536544,1528,22182,CAKE STAND VICTORIAN FILIGREE SMALL,1,12/1/2010 14:32,4.21,,United Kingdom
536544,1529,22185,SLATE TILE NATURAL HANGING,1,12/1/2010 14:32,3.36,,United Kingdom
536544,1530,22189,CREAM HEART CARD HOLDER,1,12/1/2010 14:32,8.47,,United Kingdom
536544,1531,22190,LOCAL CAFE MUG,3,12/1/2010 14:32,2.51,,United Kingdom
536544,1532,22195,LARGE HEART MEASURING SPOONS,1,12/1/2010 14:32,3.36,,United Kingdom
536544,1533,22196,SMALL HEART MEASURING SPOONS,2,12/1/2010 14:32,1.66,,United Kingdom
536544,1534,22197,SMALL POPCORN HOLDER,2,12/1/2010 14:32,1.66,,United Kingdom
536544,1535,22198,LARGE POPCORN HOLDER ,4,12/1/2010 14:32,3.36,,United Kingdom
536544,1536,22203,MILK PAN RED RETROSPOT,1,12/1/2010 14:32,7.62,,United Kingdom
536544,1537,22207,FRYING PAN UNION FLAG,1,12/1/2010 14:32,8.47,,United Kingdom
536544,1538,22219,LOVEBIRD HANGING DECORATION WHITE ,3,12/1/2010 14:32,1.66,,United Kingdom
536544,1539,22224,WHITE LOVEBIRD LANTERN,1,12/1/2010 14:32,5.91,,United Kingdom
536544,1540,22265,EASTER DECORATION NATURAL CHICK,2,12/1/2010 14:32,1.28,,United Kingdom
536544,1541,22276,WASH BAG VINTAGE ROSE PAISLEY,1,12/1/2010 14:32,5.91,,United Kingdom
536544,1542,22294,HEART FILIGREE DOVE  SMALL,4,12/1/2010 14:32,2.51,,United Kingdom
536544,1543,22296,HEART IVORY TRELLIS LARGE,1,12/1/2010 14:32,3.36,,United Kingdom
536544,1544,22297,HEART IVORY TRELLIS SMALL,1,12/1/2010 14:32,2.51,,United Kingdom
536544,1545,22299,PIG KEYRING WITH LIGHT & SOUND ,1,12/1/2010 14:32,2.51,,United Kingdom
536544,1546,22300,COFFEE MUG DOG + BALL DESIGN,1,12/1/2010 14:32,5.06,,United Kingdom
536544,1547,22301,COFFEE MUG CAT + BIRD DESIGN,2,12/1/2010 14:32,5.06,,United Kingdom
536544,1548,22309,TEA COSY RED  STRIPE,1,12/1/2010 14:32,5.06,,United Kingdom
536544,1549,22310,IVORY KNITTED MUG COSY ,9,12/1/2010 14:32,3.36,,United Kingdom
536544,1550,22314,OFFICE MUG WARMER CHOC+BLUE,1,12/1/2010 14:32,5.91,,United Kingdom
536544,1551,22318,FIVE HEART HANGING DECORATION,1,12/1/2010 14:32,5.91,,United Kingdom
536544,1552,22335,HEART DECORATION PAINTED ZINC ,4,12/1/2010 14:32,1.28,,United Kingdom
536544,1553,22336,DOVE DECORATION PAINTED ZINC ,4,12/1/2010 14:32,1.28,,United Kingdom
536544,1554,22345,PARTY PIZZA DISH BLUE POLKADOT,1,12/1/2010 14:32,1.66,,United Kingdom
536544,1555,22348,TEA BAG PLATE RED RETROSPOT,3,12/1/2010 14:32,1.66,,United Kingdom
536544,1556,22355,CHARLOTTE BAG SUKI DESIGN,3,12/1/2010 14:32,1.66,,United Kingdom
536544,1557,22356,CHARLOTTE BAG PINK POLKADOT,9,12/1/2010 14:32,1.66,,United Kingdom
536544,1558,22357,KINGS CHOICE BISCUIT TIN,1,12/1/2010 14:32,8.47,,United Kingdom
536544,1559,22359,GLASS JAR KINGS CHOICE,2,12/1/2010 14:32,5.91,,United Kingdom
536544,1560,22360,GLASS JAR ENGLISH CONFECTIONERY,2,12/1/2010 14:32,5.91,,United Kingdom
536544,1561,22361,GLASS JAR DAISY FRESH COTTON WOOL,2,12/1/2010 14:32,5.91,,United Kingdom
536544,1562,22367,CHILDRENS APRON SPACEBOY DESIGN,1,12/1/2010 14:32,4.21,,United Kingdom
536544,1563,22371,AIRLINE BAG VINTAGE TOKYO 78,1,12/1/2010 14:32,8.47,,United Kingdom
536544,1564,22375,AIRLINE BAG VINTAGE JET SET BROWN,2,12/1/2010 14:32,8.47,,United Kingdom
536544,1565,22376,AIRLINE BAG VINTAGE JET SET WHITE,1,12/1/2010 14:32,8.47,,United Kingdom
536544,1566,22378,WALL TIDY RETROSPOT ,2,12/1/2010 14:32,4.21,,United Kingdom
536544,1567,22379,RECYCLING BAG RETROSPOT ,2,12/1/2010 14:32,4.21,,United Kingdom
536544,1568,22380,TOY TIDY SPACEBOY  ,1,12/1/2010 14:32,4.21,,United Kingdom
536544,1569,22383,LUNCH BAG SUKI  DESIGN ,1,12/1/2010 14:32,4.21,,United Kingdom
536544,1570,22384,LUNCH BAG PINK POLKADOT,2,12/1/2010 14:32,4.21,,United Kingdom
536544,1571,22394,PAPERWEIGHT KINGS CHOICE ,1,12/1/2010 14:32,5.06,,United Kingdom
536544,1572,22396,MAGNETS PACK OF 4 RETRO PHOTO,1,12/1/2010 14:32,2.51,,United Kingdom
536544,1573,22418,10 COLOUR SPACEBOY PEN,1,12/1/2010 14:32,1.66,,United Kingdom
536544,1574,22419,LIPSTICK PEN RED,4,12/1/2010 14:32,0.85,,United Kingdom
536544,1575,22422,TOOTHPASTE TUBE PEN,2,12/1/2010 14:32,1.28,,United Kingdom
536544,1576,22423,REGENCY CAKESTAND 3 TIER,40,12/1/2010 14:32,12.72,,United Kingdom
536544,1577,22430,ENAMEL WATERING CAN CREAM,1,12/1/2010 14:32,10.17,,United Kingdom
536544,1578,22432,WATERING CAN PINK BUNNY,1,12/1/2010 14:32,4.21,,United Kingdom
536544,1579,22437,SET OF 9 BLACK SKULL BALLOONS,1,12/1/2010 14:32,1.66,,United Kingdom
536544,1580,22444,GROW YOUR OWN PLANT IN A CAN ,1,12/1/2010 14:32,2.51,,United Kingdom
536544,1581,22451,SILK PURSE BABUSHKA RED,2,12/1/2010 14:32,6.77,,United Kingdom
536544,1582,22457,NATURAL SLATE HEART CHALKBOARD ,6,12/1/2010 14:32,5.91,,United Kingdom
536544,1583,22469,HEART OF WICKER SMALL,8,12/1/2010 14:32,3.36,,United Kingdom
536544,1584,22470,HEART OF WICKER LARGE,1,12/1/2010 14:32,5.91,,United Kingdom
536544,1585,22471,TV DINNER TRAY AIR HOSTESS ,1,12/1/2010 14:32,11.02,,United Kingdom
536544,1586,22476,EMPIRE UNION JACK TV DINNER TRAY,1,12/1/2010 14:32,11.02,,United Kingdom
536544,1587,22477,WATERING CAN GARDEN MARKER,2,12/1/2010 14:32,2.51,,United Kingdom
536544,1588,22478,BIRDHOUSE GARDEN MARKER ,1,12/1/2010 14:32,2.51,,United Kingdom
536544,1589,22479,DAISY GARDEN MARKER,1,12/1/2010 14:32,2.51,,United Kingdom
536544,1590,22487,WHITE WOOD GARDEN PLANT LADDER,1,12/1/2010 14:32,20.38,,United Kingdom
536544,1591,22489,PACK OF 12 TRADITIONAL CRAYONS,1,12/1/2010 14:32,0.85,,United Kingdom
536544,1592,22494,EMERGENCY FIRST AID TIN ,2,12/1/2010 14:32,2.51,,United Kingdom
536544,1593,22497,SET OF 2 TINS VINTAGE BATHROOM ,2,12/1/2010 14:32,8.47,,United Kingdom
536544,1594,22515,CHILDS GARDEN SPADE PINK,1,12/1/2010 14:32,4.21,,United Kingdom
536544,1595,22517,CHILDS GARDEN RAKE PINK,1,12/1/2010 14:32,4.21,,United Kingdom
536544,1596,22519,CHILDS GARDEN BRUSH PINK,1,12/1/2010 14:32,4.21,,United Kingdom
536544,1597,22530,MAGIC DRAWING SLATE DOLLY GIRL ,5,12/1/2010 14:32,0.85,,United Kingdom
536544,1598,22531,MAGIC DRAWING SLATE CIRCUS PARADE  ,8,12/1/2010 14:32,0.85,,United Kingdom
536544,1599,22539,MINI JIGSAW DOLLY GIRL,4,12/1/2010 14:32,0.85,,United Kingdom
536544,1600,22540,MINI JIGSAW CIRCUS PARADE ,1,12/1/2010 14:32,0.85,,United Kingdom
536544,1601,22545,MINI JIGSAW BUNNIES,1,12/1/2010 14:32,0.85,,United Kingdom
536544,1602,22548,HEADS AND TAILS SPORTING FUN,1,12/1/2010 14:32,2.51,,United Kingdom
536544,1603,22549,PICTURE DOMINOES,1,12/1/2010 14:32,3.36,,United Kingdom
536544,1604,22550,HOLIDAY FUN LUDO,2,12/1/2010 14:32,7.62,,United Kingdom
536544,1605,22553,PLASTERS IN TIN SKULLS,1,12/1/2010 14:32,3.36,,United Kingdom
536544,1606,22555,PLASTERS IN TIN STRONGMAN,1,12/1/2010 14:32,3.36,,United Kingdom
536544,1607,22558,CLOTHES PEGS RETROSPOT PACK 24 ,4,12/1/2010 14:32,2.51,,United Kingdom
536544,1608,22560,TRADITIONAL MODELLING CLAY,1,12/1/2010 14:32,2.51,,United Kingdom
536544,1609,22569,FELTCRAFT CUSHION BUTTERFLY,1,12/1/2010 14:32,7.62,,United Kingdom
536544,1610,22571,ROCKING HORSE RED CHRISTMAS ,1,12/1/2010 14:32,1.66,,United Kingdom
536544,1611,22573,STAR WOODEN CHRISTMAS DECORATION,5,12/1/2010 14:32,1.66,,United Kingdom
536544,1612,22574,HEART WOODEN CHRISTMAS DECORATION,1,12/1/2010 14:32,1.66,,United Kingdom
536544,1613,22580,ADVENT CALENDAR GINGHAM SACK,1,12/1/2010 14:32,11.87,,United Kingdom
536544,1614,22582,PACK OF 6 SWEETIE GIFT BOXES,1,12/1/2010 14:32,5.06,,United Kingdom
536544,1615,22583,PACK OF 6 HANDBAG GIFT BOXES,1,12/1/2010 14:32,5.06,,United Kingdom
536544,1616,22588,CARD HOLDER GINGHAM HEART,3,12/1/2010 14:32,5.06,,United Kingdom
536544,1617,22589,CARDHOLDER GINGHAM STAR,1,12/1/2010 14:32,5.06,,United Kingdom
536544,1618,22595,CHRISTMAS GINGHAM HEART,1,12/1/2010 14:32,1.66,,United Kingdom
536544,1619,22600,CHRISTMAS RETROSPOT STAR WOOD,1,12/1/2010 14:32,1.66,,United Kingdom
536544,1620,22601,CHRISTMAS RETROSPOT ANGEL WOOD,2,12/1/2010 14:32,1.66,,United Kingdom
536544,1621,22603,CHRISTMAS RETROSPOT TREE WOOD,4,12/1/2010 14:32,1.66,,United Kingdom
536544,1622,22605,WOODEN CROQUET GARDEN SET,1,12/1/2010 14:32,25.49,,United Kingdom
536544,1623,22614,PACK OF 12 SPACEBOY TISSUES,1,12/1/2010 14:32,0.85,,United Kingdom
536544,1624,22616,PACK OF 12 LONDON TISSUES ,3,12/1/2010 14:32,0.85,,United Kingdom
536544,1625,22620,4 TRADITIONAL SPINNING TOPS,7,12/1/2010 14:32,2.51,,United Kingdom
536544,1626,22625,RED KITCHEN SCALES,2,12/1/2010 14:32,16.98,,United Kingdom
536544,1627,22629,SPACEBOY LUNCH BOX ,1,12/1/2010 14:32,4.21,,United Kingdom
536544,1628,22632,HAND WARMER RED RETROSPOT,1,12/1/2010 14:32,4.21,,United Kingdom
536544,1629,22635,CHILDS BREAKFAST SET DOLLY GIRL ,1,12/1/2010 14:32,20.38,,United Kingdom
536544,1630,22639,SET OF 4 NAPKIN CHARMS HEARTS,1,12/1/2010 14:32,5.06,,United Kingdom
536544,1631,22644,CERAMIC CHERRY CAKE MONEY BANK,1,12/1/2010 14:32,3.36,,United Kingdom
536544,1632,22645,CERAMIC HEART FAIRY CAKE MONEY BANK,1,12/1/2010 14:32,3.36,,United Kingdom
536544,1633,22646,CERAMIC STRAWBERRY CAKE MONEY BANK,1,12/1/2010 14:32,3.36,,United Kingdom
536544,1634,22651,GENTLEMAN SHIRT REPAIR KIT ,3,12/1/2010 14:32,1.66,,United Kingdom
536544,1635,22654,DELUXE SEWING KIT ,1,12/1/2010 14:32,11.87,,United Kingdom
536544,1636,22662,LUNCH BAG DOLLY GIRL DESIGN,2,12/1/2010 14:32,4.21,,United Kingdom
536544,1637,22664,TOY TIDY DOLLY GIRL DESIGN,4,12/1/2010 14:32,4.21,,United Kingdom
536544,1638,22665,RECIPE BOX BLUE SKETCHBOOK DESIGN,1,12/1/2010 14:32,5.91,,United Kingdom
536544,1639,22666,RECIPE BOX PANTRY YELLOW DESIGN,2,12/1/2010 14:32,5.91,,United Kingdom
536544,1640,22669,RED BABY BUNTING ,1,12/1/2010 14:32,5.91,,United Kingdom
536544,1641,22675,FRENCH KITCHEN SIGN BLUE METAL,2,12/1/2010 14:32,2.51,,United Kingdom
536544,1642,22694,WICKER STAR ,4,12/1/2010 14:32,4.21,,United Kingdom
536544,1643,22695,WICKER WREATH SMALL,2,12/1/2010 14:32,3.36,,United Kingdom
536544,1644,22697,GREEN REGENCY TEACUP AND SAUCER,6,12/1/2010 14:32,5.91,,United Kingdom
536544,1645,22699,ROSES REGENCY TEACUP AND SAUCER ,2,12/1/2010 14:32,5.91,,United Kingdom
536544,1646,22719,GUMBALL MONOCHROME COAT RACK,1,12/1/2010 14:32,2.51,,United Kingdom
536544,1647,22727,ALARM CLOCK BAKELIKE RED ,2,12/1/2010 14:32,7.62,,United Kingdom
536544,1648,22728,ALARM CLOCK BAKELIKE PINK,1,12/1/2010 14:32,7.62,,United Kingdom
536544,1649,22729,ALARM CLOCK BAKELIKE ORANGE,2,12/1/2010 14:32,7.62,,United Kingdom
536544,1650,22730,ALARM CLOCK BAKELIKE IVORY,1,12/1/2010 14:32,7.62,,United Kingdom
536544,1651,22734,SET OF 6 RIBBONS VINTAGE CHRISTMAS,3,12/1/2010 14:32,5.06,,United Kingdom
536544,1652,22737,RIBBON REEL CHRISTMAS PRESENT ,1,12/1/2010 14:32,3.36,,United Kingdom
536544,1653,22738,RIBBON REEL SNOWY VILLAGE,3,12/1/2010 14:32,3.36,,United Kingdom
536544,1654,22739,RIBBON REEL CHRISTMAS SOCK BAUBLE,1,12/1/2010 14:32,3.36,,United Kingdom
536544,1655,22740,POLKADOT PEN,13,12/1/2010 14:32,1.66,,United Kingdom
536544,1656,22741,FUNKY DIVA PEN,8,12/1/2010 14:32,1.66,,United Kingdom
536544,1657,22744,MAKE YOUR OWN MONSOON CARD KIT,1,12/1/2010 14:32,5.91,,United Kingdom
536544,1658,22745,POPPY'S PLAYHOUSE BEDROOM ,1,12/1/2010 14:32,4.21,,United Kingdom
536544,1659,22748,POPPY'S PLAYHOUSE KITCHEN,1,12/1/2010 14:32,4.21,,United Kingdom
536544,1660,22755,SMALL PURPLE BABUSHKA NOTEBOOK ,3,12/1/2010 14:32,1.66,,United Kingdom
536544,1661,22757,LARGE RED BABUSHKA NOTEBOOK ,3,12/1/2010 14:32,2.51,,United Kingdom
536544,1662,22758,LARGE PURPLE BABUSHKA NOTEBOOK  ,2,12/1/2010 14:32,2.51,,United Kingdom
536544,1663,22759,SET OF 3 NOTEBOOKS IN PARCEL,3,12/1/2010 14:32,3.36,,United Kingdom
536544,1664,22760,"TRAY, BREAKFAST IN BED",1,12/1/2010 14:32,25.49,,United Kingdom
536544,1665,22769,CHALKBOARD KITCHEN ORGANISER,1,12/1/2010 14:32,51.02,,United Kingdom
536544,1666,22791,T-LIGHT GLASS FLUTED ANTIQUE,3,12/1/2010 14:32,2.51,,United Kingdom
536544,1667,22792,FLUTED ANTIQUE CANDLE HOLDER,2,12/1/2010 14:32,1.66,,United Kingdom
536544,1668,22798,ANTIQUE GLASS DRESSING TABLE POT,2,12/1/2010 14:32,5.91,,United Kingdom
536544,1669,22812,PACK 3 BOXES CHRISTMAS PANNETONE,2,12/1/2010 14:32,4.21,,United Kingdom
536544,1670,22813,PACK 3 BOXES BIRD PANNETONE ,1,12/1/2010 14:32,4.21,,United Kingdom
536544,1671,22816,CARD MOTORBIKE SANTA,4,12/1/2010 14:32,0.85,,United Kingdom
536544,1672,22818,CARD CHRISTMAS VILLAGE,6,12/1/2010 14:32,0.85,,United Kingdom
536544,1673,22822,CREAM WALL PLANTER HEART SHAPED,1,12/1/2010 14:32,12.72,,United Kingdom
536544,1674,22835,HOT WATER BOTTLE I AM SO POORLY,4,12/1/2010 14:32,9.32,,United Kingdom
536544,1675,22837,HOT WATER BOTTLE BABUSHKA ,1,12/1/2010 14:32,9.32,,United Kingdom
536544,1676,22844,VINTAGE CREAM DOG FOOD CONTAINER,1,12/1/2010 14:32,16.98,,United Kingdom
536544,1677,22847,BREAD BIN DINER STYLE IVORY,1,12/1/2010 14:32,34.0,,United Kingdom
536544,1678,22862,LOVE HEART NAPKIN BOX ,1,12/1/2010 14:32,8.47,,United Kingdom
536544,1679,22865,HAND WARMER OWL DESIGN,1,12/1/2010 14:32,4.21,,United Kingdom
536544,1680,22866,HAND WARMER SCOTTY DOG DESIGN,4,12/1/2010 14:32,4.21,,United Kingdom
536544,1681,22867,HAND WARMER BIRD DESIGN,4,12/1/2010 14:32,4.21,,United Kingdom
536544,1682,22876,NUMBER TILE COTTAGE GARDEN 8,1,12/1/2010 14:32,4.21,,United Kingdom
536544,1683,22899,CHILDREN'S APRON DOLLY GIRL ,2,12/1/2010 14:32,4.21,,United Kingdom
536544,1684,22900, SET 2 TEA TOWELS I LOVE LONDON ,1,12/1/2010 14:32,5.91,,United Kingdom
536544,1685,22906,12 MESSAGE CARDS WITH ENVELOPES,2,12/1/2010 14:32,3.36,,United Kingdom
536544,1686,22909,SET OF 20 VINTAGE CHRISTMAS NAPKINS,3,12/1/2010 14:32,1.66,,United Kingdom
536544,1687,22910,PAPER CHAIN KIT VINTAGE CHRISTMAS,4,12/1/2010 14:32,5.91,,United Kingdom
536544,1688,22916,HERB MARKER THYME,1,12/1/2010 14:32,1.66,,United Kingdom
536544,1689,22917,HERB MARKER ROSEMARY,1,12/1/2010 14:32,1.66,,United Kingdom
536544,1690,22918,HERB MARKER PARSLEY,1,12/1/2010 14:32,1.66,,United Kingdom
536544,1691,22919,HERB MARKER MINT,1,12/1/2010 14:32,1.66,,United Kingdom
536544,1692,22920,HERB MARKER BASIL,1,12/1/2010 14:32,1.66,,United Kingdom
536544,1693,22921,HERB MARKER CHIVES ,1,12/1/2010 14:32,1.66,,United Kingdom
536544,1694,22928,YELLOW GIANT GARDEN THERMOMETER,1,12/1/2010 14:32,11.87,,United Kingdom
536544,1695,22940,FELTCRAFT CHRISTMAS FAIRY,2,12/1/2010 14:32,8.47,,United Kingdom
536544,1696,22945,CHRISTMAS METAL TAGS ASSORTED ,1,12/1/2010 14:32,11.02,,United Kingdom
536544,1697,22948,METAL DECORATION NAUGHTY CHILDREN ,2,12/1/2010 14:32,6.77,,United Kingdom
536544,1698,22949,36 DOILIES DOLLY GIRL,1,12/1/2010 14:32,2.98,,United Kingdom
536544,1699,22951,60 CAKE CASES DOLLY GIRL DESIGN,2,12/1/2010 14:32,1.28,,United Kingdom
536544,1700,22952,60 CAKE CASES VINTAGE CHRISTMAS,1,12/1/2010 14:32,1.28,,United Kingdom
536544,1701,22956,36 FOIL HEART CAKE CASES,1,12/1/2010 14:32,4.21,,United Kingdom
536544,1702,22960,JAM MAKING SET WITH JARS,7,12/1/2010 14:32,8.47,,United Kingdom
536544,1703,22961,JAM MAKING SET PRINTED,9,12/1/2010 14:32,3.36,,United Kingdom
536544,1704,22962,JAM JAR WITH PINK LID,4,12/1/2010 14:32,1.66,,United Kingdom
536544,1705,22963,JAM JAR WITH GREEN LID,1,12/1/2010 14:32,1.66,,United Kingdom
536544,1706,22966,GINGERBREAD MAN COOKIE CUTTER,3,12/1/2010 14:32,2.51,,United Kingdom
536544,1707,22969,HOMEMADE JAM SCENTED CANDLES,1,12/1/2010 14:32,3.36,,United Kingdom
536544,1708,22972,CHILDREN'S SPACEBOY MUG,1,12/1/2010 14:32,3.36,,United Kingdom
536544,1709,22974,CHILDRENS DOLLY GIRL MUG,3,12/1/2010 14:32,3.36,,United Kingdom
536544,1710,22975,SPACEBOY CHILDRENS EGG CUP,2,12/1/2010 14:32,2.51,,United Kingdom
536544,1711,22976,CIRCUS PARADE CHILDRENS EGG CUP ,1,12/1/2010 14:32,2.51,,United Kingdom
536544,1712,22988,SOLDIERS EGG CUP ,3,12/1/2010 14:32,2.51,,United Kingdom
536544,1713,35095A,BLUE VICTORIAN FABRIC OVAL BOX,2,12/1/2010 14:32,0.84,,United Kingdom
536544,1714,35095B,RED VICTORIAN FABRIC OVAL BOX,1,12/1/2010 14:32,0.84,,United Kingdom
536544,1715,35471D,SET OF 3 BIRD LIGHT PINK FEATHER ,1,12/1/2010 14:32,2.51,,United Kingdom
536544,1716,35598D,PINK/WHITE CHRISTMAS TREE 60CM,1,12/1/2010 14:32,2.51,,United Kingdom
536544,1717,35599D,PINK AND WHITE CHRISTMAS TREE 120CM,1,12/1/2010 14:32,5.91,,United Kingdom
536544,1718,35610A,PINK CHRISTMAS FLOCK DROPLET ,1,12/1/2010 14:32,2.51,,United Kingdom
536544,1719,35818P,"ACRYLIC JEWEL ICICLE, PINK",1,12/1/2010 14:32,3.36,,United Kingdom
536544,1720,35957,SMALLFOLKART BAUBLE CHRISTMAS DEC,2,12/1/2010 14:32,1.66,,United Kingdom
536544,1721,35961,FOLKART ZINC HEART CHRISTMAS DEC,1,12/1/2010 14:32,1.66,,United Kingdom
536544,1722,35971,ROSE FOLKART HEART DECORATIONS,1,12/1/2010 14:32,2.51,,United Kingdom
536544,1723,37370,RETRO COFFEE MUGS ASSORTED,1,12/1/2010 14:32,16.13,,United Kingdom
536544,1724,37449,CERAMIC CAKE STAND + HANGING CAKES,1,12/1/2010 14:32,21.23,,United Kingdom
536544,1725,37476,CONDIMENT TRAY 4 BOWLS AND 4 SPOONS,1,12/1/2010 14:32,18.68,,United Kingdom
536544,1726,47559B,TEA TIME OVEN GLOVE,2,12/1/2010 14:32,2.51,,United Kingdom
536544,1727,47580,TEA TIME DES TEA COSY,1,12/1/2010 14:32,5.06,,United Kingdom
536544,1728,47591B,SCOTTIES CHILDRENS APRON,2,12/1/2010 14:32,1.66,,United Kingdom
536544,1729,47591D,PINK FAIRY CAKE CHILDRENS APRON,1,12/1/2010 14:32,4.21,,United Kingdom
