InvoiceNo,Unnamed: 0,StockCode,Description,Quantity,InvoiceDate,UnitPrice,CustomerID,Country
536412,572,85049E,SCANDINAVIAN REDS RIBBONS,1,12/1/2010 11:49,1.25,17920.0,United Kingdom
536412,573,22243,5 HOOK HANGER RED MAGIC TOADSTOOL,6,12/1/2010 11:49,1.65,17920.0,United Kingdom
536412,574,22141,CHRISTMAS CRAFT TREE TOP ANGEL,1,12/1/2010 11:49,2.1,17920.0,United Kingdom
536412,575,22144,CHRISTMAS CRAFT LITTLE FRIENDS,2,12/1/2010 11:49,2.1,17920.0,United Kingdom
536412,576,22243,5 HOOK HANGER RED MAGIC TOADSTOOL,3,12/1/2010 11:49,1.65,17920.0,United Kingdom
536412,577,22077,6 RIBBONS RUSTIC CHARM,7,12/1/2010 11:49,1.65,17920.0,United Kingdom
536412,578,21448,12 DAISY PEGS IN WOOD BOX,1,12/1/2010 11:49,1.65,17920.0,United Kingdom
536412,579,22759,SET OF 3 NOTEBOOKS IN PARCEL,5,12/1/2010 11:49,1.65,17920.0,United Kingdom
536412,580,22242,5 HOOK HANGER MAGIC TOADSTOOL,5,12/1/2010 11:49,1.65,17920.0,United Kingdom
536412,581,85049E,SCANDINAVIAN REDS RIBBONS,12,12/1/2010 11:49,1.25,17920.0,United Kingdom
536412,582,21731,RED TOADSTOOL LED NIGHT LIGHT,5,12/1/2010 11:49,1.65,17920.0,United Kingdom
536412,583,22243,5 HOOK HANGER RED MAGIC TOADSTOOL,1,12/1/2010 11:49,1.65,17920.0,United Kingdom
536412,584,21739,COSY SLIPPER SHOES SMALL GREEN,2,12/1/2010 11:49,2.95,17920.0,United Kingdom
536412,585,21738,COSY SLIPPER SHOES SMALL  RED ,5,12/1/2010 11:49,2.95,17920.0,United Kingdom
536412,586,22271,FELTCRAFT DOLL ROSIE,2,12/1/2010 11:49,2.95,17920.0,United Kingdom
536412,587,22273,FELTCRAFT DOLL MOLLY,1,12/1/2010 11:49,2.95,17920.0,United Kingdom
536412,588,22274,FELTCRAFT DOLL EMILY,2,12/1/2010 11:49,2.95,17920.0,United Kingdom
536412,589,22749,FELTCRAFT PRINCESS CHARLOTTE DOLL,1,12/1/2010 11:49,3.75,17920.0,United Kingdom
536412,590,22751,FELTCRAFT PRINCESS OLIVIA DOLL,2,12/1/2010 11:49,3.75,17920.0,United Kingdom
536412,591,21034,REX CASH+CARRY JUMBO SHOPPER,1,12/1/2010 11:49,0.95,17920.0,United Kingdom
536412,592,22273,FELTCRAFT DOLL MOLLY,2,12/1/2010 11:49,2.95,17920.0,United Kingdom
536412,593,22568,FELTCRAFT CUSHION OWL,3,12/1/2010 11:49,3.75,17920.0,United Kingdom
536412,594,22141,CHRISTMAS CRAFT TREE TOP ANGEL,1,12/1/2010 11:49,2.1,17920.0,United Kingdom
536412,595,22144,CHRISTMAS CRAFT LITTLE FRIENDS,1,12/1/2010 11:49,2.1,17920.0,United Kingdom
536412,596,22570,FELTCRAFT CUSHION RABBIT,3,12/1/2010 11:49,3.75,17920.0,United Kingdom
536412,597,22569,FELTCRAFT CUSHION BUTTERFLY,2,12/1/2010 11:49,3.75,17920.0,United Kingdom
536412,598,21448,12 DAISY PEGS IN WOOD BOX,1,12/1/2010 11:49,1.65,17920.0,United Kingdom
536412,599,22086,PAPER CHAIN KIT 50'S CHRISTMAS ,1,12/1/2010 11:49,2.95,17920.0,United Kingdom
536412,600,22569,FELTCRAFT CUSHION BUTTERFLY,2,12/1/2010 11:49,3.75,17920.0,United Kingdom
536412,601,21448,12 DAISY PEGS IN WOOD BOX,2,12/1/2010 11:49,1.65,17920.0,United Kingdom
536412,602,22968,ROSE COTTAGE KEEPSAKE BOX ,4,12/1/2010 11:49,9.95,17920.0,United Kingdom
536412,603,22902,TOTE BAG I LOVE LONDON,7,12/1/2010 11:49,2.1,17920.0,United Kingdom
536412,604,21448,12 DAISY PEGS IN WOOD BOX,2,12/1/2010 11:49,1.65,17920.0,United Kingdom
536412,605,22902,TOTE BAG I LOVE LONDON,7,12/1/2010 11:49,2.1,17920.0,United Kingdom
536412,606,21710,FOLDING UMBRELLA PINKWHITE POLKADOT,1,12/1/2010 11:49,4.95,17920.0,United Kingdom
536412,607,21708,FOLDING UMBRELLA CREAM POLKADOT,1,12/1/2010 11:49,4.95,17920.0,United Kingdom
536412,608,21711,FOLDING UMBRELLA WHITE/RED POLKADOT,1,12/1/2010 11:49,4.95,17920.0,United Kingdom
536412,609,22179,SET 10 LIGHTS NIGHT OWL,2,12/1/2010 11:49,6.75,17920.0,United Kingdom
536412,610,22197,SMALL POPCORN HOLDER,5,12/1/2010 11:49,0.85,17920.0,United Kingdom
536412,611,22900, SET 2 TEA TOWELS I LOVE LONDON ,2,12/1/2010 11:49,2.95,17920.0,United Kingdom
536412,612,21706,FOLDING UMBRELLA RED/WHITE POLKADOT,1,12/1/2010 11:49,4.95,17920.0,United Kingdom
536412,613,22468,BABUSHKA LIGHTS STRING OF 10,2,12/1/2010 11:49,6.75,17920.0,United Kingdom
536412,614,20725,LUNCH BAG RED RETROSPOT,1,12/1/2010 11:49,1.65,17920.0,United Kingdom
536412,615,85184C,S/4 VALENTINE DECOUPAGE HEART BOX,1,12/1/2010 11:49,2.95,17920.0,United Kingdom
536412,616,21708,FOLDING UMBRELLA CREAM POLKADOT,1,12/1/2010 11:49,4.95,17920.0,United Kingdom
536412,617,22900, SET 2 TEA TOWELS I LOVE LONDON ,2,12/1/2010 11:49,2.95,17920.0,United Kingdom
536412,618,21706,FOLDING UMBRELLA RED/WHITE POLKADOT,1,12/1/2010 11:49,4.95,17920.0,United Kingdom
536412,619,22988,SOLDIERS EGG CUP ,6,12/1/2010 11:49,1.25,17920.0,United Kingdom
536412,620,85184C,S/4 VALENTINE DECOUPAGE HEART BOX,1,12/1/2010 11:49,2.95,17920.0,United Kingdom
536412,621,20750,RED RETROSPOT MINI CASES,1,12/1/2010 11:49,7.95,17920.0,United Kingdom
536414,622,22139,,56,12/1/2010 11:52,0.0,,United Kingdom
536415,623,22952,60 CAKE CASES VINTAGE CHRISTMAS,10,12/1/2010 11:57,0.55,12838.0,United Kingdom
536415,624,22910,PAPER CHAIN KIT VINTAGE CHRISTMAS,5,12/1/2010 11:57,2.95,12838.0,United Kingdom
536415,625,22739,RIBBON REEL CHRISTMAS SOCK BAUBLE,3,12/1/2010 11:57,1.65,12838.0,United Kingdom
536415,626,22738,RIBBON REEL SNOWY VILLAGE,3,12/1/2010 11:57,1.65,12838.0,United Kingdom
536415,627,22736,RIBBON REEL MAKING SNOWMEN ,3,12/1/2010 11:57,1.65,12838.0,United Kingdom
536415,628,22909,SET OF 20 VINTAGE CHRISTMAS NAPKINS,5,12/1/2010 11:57,0.85,12838.0,United Kingdom
536415,629,35591T,TURQUOISE CHRISTMAS TREE ,2,12/1/2010 11:57,1.25,12838.0,United Kingdom
536415,630,22186,RED STAR CARD HOLDER,5,12/1/2010 11:57,2.95,12838.0,United Kingdom
536415,631,22695,WICKER WREATH SMALL,3,12/1/2010 11:57,1.45,12838.0,United Kingdom
536415,632,22470,HEART OF WICKER LARGE,1,12/1/2010 11:57,2.95,12838.0,United Kingdom
536415,633,22580,ADVENT CALENDAR GINGHAM SACK,1,12/1/2010 11:57,5.95,12838.0,United Kingdom
536415,634,22469,HEART OF WICKER SMALL,5,12/1/2010 11:57,1.65,12838.0,United Kingdom
536415,635,22147,FELTCRAFT BUTTERFLY HEARTS,4,12/1/2010 11:57,1.45,12838.0,United Kingdom
536415,636,22130,PARTY CONE CHRISTMAS DECORATION ,6,12/1/2010 11:57,0.85,12838.0,United Kingdom
536415,637,21791,VINTAGE HEADS AND TAILS CARD GAME ,3,12/1/2010 11:57,1.25,12838.0,United Kingdom
536415,638,22694,WICKER STAR ,5,12/1/2010 11:57,2.1,12838.0,United Kingdom
536415,639,21790,VINTAGE SNAP CARDS,3,12/1/2010 11:57,0.85,12838.0,United Kingdom
536415,640,22149,FELTCRAFT 6 FLOWER FRIENDS,4,12/1/2010 11:57,2.1,12838.0,United Kingdom
536415,641,22900, SET 2 TEA TOWELS I LOVE LONDON ,3,12/1/2010 11:57,2.95,12838.0,United Kingdom
536415,642,22961,JAM MAKING SET PRINTED,3,12/1/2010 11:57,1.45,12838.0,United Kingdom
536415,643,22321,BIRD DECORATION RED RETROSPOT,12,12/1/2010 11:57,0.85,12838.0,United Kingdom
536415,644,22594,CHRISTMAS GINGHAM TREE,5,12/1/2010 11:57,0.85,12838.0,United Kingdom
536415,645,22593,CHRISTMAS GINGHAM STAR,4,12/1/2010 11:57,0.85,12838.0,United Kingdom
536415,646,22595,CHRISTMAS GINGHAM HEART,6,12/1/2010 11:57,0.85,12838.0,United Kingdom
536415,647,21986,PACK OF 12 PINK POLKADOT TISSUES,12,12/1/2010 11:57,0.29,12838.0,United Kingdom
536415,648,22750,FELTCRAFT PRINCESS LOLA DOLL,2,12/1/2010 11:57,3.75,12838.0,United Kingdom
536415,649,22616,PACK OF 12 LONDON TISSUES ,12,12/1/2010 11:57,0.29,12838.0,United Kingdom
536415,650,22775,PURPLE DRAWERKNOB ACRYLIC EDWARDIAN,1,12/1/2010 11:57,1.25,12838.0,United Kingdom
536415,651,22899,CHILDREN'S APRON DOLLY GIRL ,2,12/1/2010 11:57,2.1,12838.0,United Kingdom
536415,652,22367,CHILDRENS APRON SPACEBOY DESIGN,3,12/1/2010 11:57,1.95,12838.0,United Kingdom
536415,653,22942,CHRISTMAS LIGHTS 10 SANTAS ,3,12/1/2010 11:57,8.5,12838.0,United Kingdom
536415,654,22941,CHRISTMAS LIGHTS 10 REINDEER,3,12/1/2010 11:57,8.5,12838.0,United Kingdom
536415,655,22086,PAPER CHAIN KIT 50'S CHRISTMAS ,6,12/1/2010 11:57,2.95,12838.0,United Kingdom
536415,656,22940,FELTCRAFT CHRISTMAS FAIRY,2,12/1/2010 11:57,4.25,12838.0,United Kingdom
536415,657,21212,PACK OF 72 RETROSPOT CAKE CASES,2,12/1/2010 11:57,0.55,12838.0,United Kingdom
536415,658,21976,PACK OF 60 MUSHROOM CAKE CASES,2,12/1/2010 11:57,0.55,12838.0,United Kingdom
536415,659,22951,60 CAKE CASES DOLLY GIRL DESIGN,2,12/1/2010 11:57,0.55,12838.0,United Kingdom
536415,660,21977,PACK OF 60 PINK PAISLEY CAKE CASES,3,12/1/2010 11:57,0.55,12838.0,United Kingdom
536415,661,22834,HAND WARMER BABUSHKA DESIGN,3,12/1/2010 11:57,2.1,12838.0,United Kingdom
536415,662,22867,HAND WARMER BIRD DESIGN,3,12/1/2010 11:57,2.1,12838.0,United Kingdom
536415,663,22865,HAND WARMER OWL DESIGN,3,12/1/2010 11:57,2.1,12838.0,United Kingdom
536415,664,22632,HAND WARMER RED RETROSPOT,3,12/1/2010 11:57,2.1,12838.0,United Kingdom
536415,665,21916,SET 12 RETRO WHITE CHALK STICKS,2,12/1/2010 11:57,0.42,12838.0,United Kingdom
536415,666,22587,FELTCRAFT HAIRBAND RED AND BLUE,4,12/1/2010 11:57,0.85,12838.0,United Kingdom
536415,667,22566,FELTCRAFT HAIRBAND PINK AND PURPLE,3,12/1/2010 11:57,0.85,12838.0,United Kingdom
536415,668,22565,FELTCRAFT HAIRBANDS PINK AND WHITE ,3,12/1/2010 11:57,0.85,12838.0,United Kingdom
536415,669,22472,TV DINNER TRAY DOLLY GIRL,2,12/1/2010 11:57,4.95,12838.0,United Kingdom
536415,670,22557,PLASTERS IN TIN VINTAGE PAISLEY ,3,12/1/2010 11:57,1.65,12838.0,United Kingdom
536415,671,22551,PLASTERS IN TIN SPACEBOY,3,12/1/2010 11:57,1.65,12838.0,United Kingdom
536415,672,22554,PLASTERS IN TIN WOODLAND ANIMALS,3,12/1/2010 11:57,1.65,12838.0,United Kingdom
536415,673,22534,MAGIC DRAWING SLATE SPACEBOY ,3,12/1/2010 11:57,0.42,12838.0,United Kingdom
536415,674,22531,MAGIC DRAWING SLATE CIRCUS PARADE  ,3,12/1/2010 11:57,0.42,12838.0,United Kingdom
536415,675,22529,MAGIC DRAWING SLATE GO TO THE FAIR ,3,12/1/2010 11:57,0.42,12838.0,United Kingdom
536415,676,22530,MAGIC DRAWING SLATE DOLLY GIRL ,3,12/1/2010 11:57,0.42,12838.0,United Kingdom
536415,677,84032B,CHARLIE + LOLA RED HOT WATER BOTTLE,3,12/1/2010 11:57,2.95,12838.0,United Kingdom
536415,678,22837,HOT WATER BOTTLE BABUSHKA ,3,12/1/2010 11:57,4.65,12838.0,United Kingdom
536415,679,85049H,URBAN BLACK RIBBONS ,2,12/1/2010 11:57,1.25,12838.0,United Kingdom
536415,680,22749,FELTCRAFT PRINCESS CHARLOTTE DOLL,2,12/1/2010 11:57,3.75,12838.0,United Kingdom
536415,681,22807,SET OF 6 T-LIGHTS TOADSTOOLS,12,12/1/2010 11:57,2.95,12838.0,United Kingdom
536416,682,21494,ROTATING LEAVES T-LIGHT HOLDER,12,12/1/2010 11:58,1.25,13255.0,United Kingdom
536416,683,21915,RED  HARMONICA IN BOX ,72,12/1/2010 11:58,1.25,13255.0,United Kingdom
536416,684,22938,CUPCAKE LACE PAPER SET 6,12,12/1/2010 11:58,1.95,13255.0,United Kingdom
536416,685,22768,FAMILY PHOTO FRAME CORNICE,4,12/1/2010 11:58,9.95,13255.0,United Kingdom
536416,686,22767,TRIPLE PHOTO FRAME CORNICE ,4,12/1/2010 11:58,9.95,13255.0,United Kingdom
536416,687,82494L,WOODEN FRAME ANTIQUE WHITE ,6,12/1/2010 11:58,2.95,13255.0,United Kingdom
536420,688,21889,WOODEN BOX OF DOMINOES,12,12/1/2010 12:03,1.25,16583.0,United Kingdom
536420,689,21892,TRADITIONAL WOODEN CATCH CUP GAME ,12,12/1/2010 12:03,1.25,16583.0,United Kingdom
536420,690,21891,TRADITIONAL WOODEN SKIPPING ROPE,12,12/1/2010 12:03,1.25,16583.0,United Kingdom
536420,691,21890,S/6 WOODEN SKITTLES IN COTTON BAG,6,12/1/2010 12:03,2.95,16583.0,United Kingdom
536420,692,21718,RED METAL BEACH SPADE ,12,12/1/2010 12:03,1.25,16583.0,United Kingdom
536420,693,21716,BOYS VINTAGE TIN SEASIDE BUCKET,8,12/1/2010 12:03,2.55,16583.0,United Kingdom
536420,694,21715,GIRLS VINTAGE TIN SEASIDE BUCKET,8,12/1/2010 12:03,2.55,16583.0,United Kingdom
536420,695,22113,GREY HEART HOT WATER BOTTLE,4,12/1/2010 12:03,3.75,16583.0,United Kingdom
536420,696,22111,SCOTTIE DOG HOT WATER BOTTLE,3,12/1/2010 12:03,4.95,16583.0,United Kingdom
536420,697,22110,BIRD HOUSE HOT WATER BOTTLE,6,12/1/2010 12:03,2.55,16583.0,United Kingdom
536420,698,22358,KINGS CHOICE TEA CADDY ,6,12/1/2010 12:03,2.95,16583.0,United Kingdom
536420,699,22357,KINGS CHOICE BISCUIT TIN,4,12/1/2010 12:03,4.25,16583.0,United Kingdom
536420,700,22115,METAL SIGN EMPIRE TEA,6,12/1/2010 12:03,2.95,16583.0,United Kingdom
536420,701,22969,HOMEMADE JAM SCENTED CANDLES,12,12/1/2010 12:03,1.45,16583.0,United Kingdom
536423,702,22619,SET OF 6 SOLDIER SKITTLES,4,12/1/2010 12:08,3.75,18085.0,United Kingdom
536423,703,21481,FAWN BLUE HOT WATER BOTTLE,6,12/1/2010 12:08,2.95,18085.0,United Kingdom
536423,704,22632,HAND WARMER RED RETROSPOT,12,12/1/2010 12:08,2.1,18085.0,United Kingdom
536423,705,22837,HOT WATER BOTTLE BABUSHKA ,8,12/1/2010 12:08,4.65,18085.0,United Kingdom
536423,706,21479,WHITE SKULL HOT WATER BOTTLE ,8,12/1/2010 12:08,3.75,18085.0,United Kingdom
536423,707,21485,RETROSPOT HEART HOT WATER BOTTLE,8,12/1/2010 12:08,4.95,18085.0,United Kingdom
536423,708,84029E,RED WOOLLY HOTTIE WHITE HEART.,8,12/1/2010 12:08,3.75,18085.0,United Kingdom
536423,709,22111,SCOTTIE DOG HOT WATER BOTTLE,16,12/1/2010 12:08,4.95,18085.0,United Kingdom
536423,710,22113,GREY HEART HOT WATER BOTTLE,8,12/1/2010 12:08,3.75,18085.0,United Kingdom
536425,711,22837,HOT WATER BOTTLE BABUSHKA ,8,12/1/2010 12:08,4.65,13758.0,United Kingdom
536425,712,22585,PACK OF 6 BIRDY GIFT TAGS,12,12/1/2010 12:08,1.25,13758.0,United Kingdom
536425,713,79321,CHILLI LIGHTS,8,12/1/2010 12:08,4.95,13758.0,United Kingdom
536425,714,22637,PIGGY BANK RETROSPOT ,12,12/1/2010 12:08,2.55,13758.0,United Kingdom
536425,715,21556,CERAMIC STRAWBERRY MONEY BOX,6,12/1/2010 12:08,2.55,13758.0,United Kingdom
536425,716,22646,CERAMIC STRAWBERRY CAKE MONEY BANK,12,12/1/2010 12:08,1.45,13758.0,United Kingdom
536425,717,22644,CERAMIC CHERRY CAKE MONEY BANK,12,12/1/2010 12:08,1.45,13758.0,United Kingdom
536425,718,22645,CERAMIC HEART FAIRY CAKE MONEY BANK,12,12/1/2010 12:08,1.45,13758.0,United Kingdom
536425,719,22650,CERAMIC PIRATE CHEST MONEY BANK,12,12/1/2010 12:08,1.45,13758.0,United Kingdom
536425,720,22508,DOORSTOP RETROSPOT HEART,8,12/1/2010 12:08,3.75,13758.0,United Kingdom
536425,721,21411,GINGHAM HEART  DOORSTOP RED,3,12/1/2010 12:08,4.25,13758.0,United Kingdom
536425,722,22511,RETROSPOT BABUSHKA DOORSTOP,4,12/1/2010 12:08,3.75,13758.0,United Kingdom
536425,723,22451,SILK PURSE BABUSHKA RED,6,12/1/2010 12:08,3.35,13758.0,United Kingdom
536425,724,22449,SILK PURSE BABUSHKA PINK,6,12/1/2010 12:08,3.35,13758.0,United Kingdom
536425,725,22768,FAMILY PHOTO FRAME CORNICE,2,12/1/2010 12:08,9.95,13758.0,United Kingdom
536425,726,22829,SWEETHEART WIRE WALL TIDY,2,12/1/2010 12:08,9.95,13758.0,United Kingdom
536425,727,22961,JAM MAKING SET PRINTED,12,12/1/2010 12:08,1.45,13758.0,United Kingdom
536437,728,21154,RED RETROSPOT OVEN GLOVE ,200,12/1/2010 12:12,1.06,13694.0,United Kingdom
536437,729,22189,CREAM HEART CARD HOLDER,72,12/1/2010 12:12,3.39,13694.0,United Kingdom
536437,730,17021,NAMASTE SWAGAT INCENSE,600,12/1/2010 12:12,0.24,13694.0,United Kingdom
536437,731,22059,CERAMIC STRAWBERRY DESIGN MUG,48,12/1/2010 12:12,1.25,13694.0,United Kingdom
536437,732,22188,BLACK HEART CARD HOLDER,36,12/1/2010 12:12,3.39,13694.0,United Kingdom
536437,733,84678,CLASSICAL ROSE SMALL VASE,48,12/1/2010 12:12,1.25,13694.0,United Kingdom
536446,734,85172,HYACINTH BULB T-LIGHT CANDLES,32,12/1/2010 12:15,0.42,15983.0,United Kingdom
536446,735,22142,CHRISTMAS CRAFT WHITE FAIRY ,2,12/1/2010 12:15,1.45,15983.0,United Kingdom
536446,736,22144,CHRISTMAS CRAFT LITTLE FRIENDS,2,12/1/2010 12:15,2.1,15983.0,United Kingdom
536446,737,21591,COSY HOUR CIGAR BOX MATCHES ,6,12/1/2010 12:15,1.25,15983.0,United Kingdom
536446,738,22480,RED TEA TOWEL CLASSIC DESIGN,12,12/1/2010 12:15,1.25,15983.0,United Kingdom
536446,739,22294,HEART FILIGREE DOVE  SMALL,48,12/1/2010 12:15,1.25,15983.0,United Kingdom
536446,740,21156,RETROSPOT CHILDRENS APRON,1,12/1/2010 12:15,1.95,15983.0,United Kingdom
536446,741,10133,COLOURING PENCILS BROWN TUBE,5,12/1/2010 12:15,0.85,15983.0,United Kingdom
536446,742,72800E,4 IVORY DINNER CANDLES SILVER FLOCK,6,12/1/2010 12:15,2.55,15983.0,United Kingdom
536446,743,22294,HEART FILIGREE DOVE  SMALL,24,12/1/2010 12:15,1.25,15983.0,United Kingdom
536446,744,84836,ZINC METAL HEART DECORATION,12,12/1/2010 12:15,1.25,15983.0,United Kingdom
536446,745,20774,GREEN FERN NOTEBOOK,2,12/1/2010 12:15,1.65,15983.0,United Kingdom
536446,746,20773,BLUE PAISLEY NOTEBOOK,2,12/1/2010 12:15,1.65,15983.0,United Kingdom
536446,747,20777,CHRYSANTHEMUM NOTEBOOK,2,12/1/2010 12:15,1.65,15983.0,United Kingdom
536446,748,16016,LARGE CHINESE STYLE SCISSOR,10,12/1/2010 12:15,0.85,15983.0,United Kingdom
536446,749,16014,SMALL CHINESE STYLE SCISSOR,10,12/1/2010 12:15,0.42,15983.0,United Kingdom
536446,750,21890,S/6 WOODEN SKITTLES IN COTTON BAG,2,12/1/2010 12:15,2.95,15983.0,United Kingdom
536446,751,21891,TRADITIONAL WOODEN SKIPPING ROPE,2,12/1/2010 12:15,1.25,15983.0,United Kingdom
536446,752,22619,SET OF 6 SOLDIER SKITTLES,8,12/1/2010 12:15,3.75,15983.0,United Kingdom
536446,753,22620,4 TRADITIONAL SPINNING TOPS,6,12/1/2010 12:15,1.25,15983.0,United Kingdom
536446,754,84347,ROTATING SILVER ANGELS T-LIGHT HLDR,12,12/1/2010 12:15,2.55,15983.0,United Kingdom
536446,755,85169B,BLACK LOVE BIRD CANDLE,24,12/1/2010 12:15,1.25,15983.0,United Kingdom
536446,756,21156,RETROSPOT CHILDRENS APRON,3,12/1/2010 12:15,1.95,15983.0,United Kingdom
536446,757,21651,HANGING GLASS ETCHED TEALIGHT,6,12/1/2010 12:15,1.65,15983.0,United Kingdom
536446,758,21651,HANGING GLASS ETCHED TEALIGHT,6,12/1/2010 12:15,1.65,15983.0,United Kingdom
536446,759,84625C,BLUE NEW BAROQUE CANDLESTICK CANDLE,10,12/1/2010 12:15,2.95,15983.0,United Kingdom
536446,760,22618,COOKING SET RETROSPOT,2,12/1/2010 12:15,9.95,15983.0,United Kingdom
536446,761,21586,KINGS CHOICE GIANT TUBE MATCHES,4,12/1/2010 12:15,2.55,15983.0,United Kingdom
536446,762,21587,COSY HOUR GIANT TUBE MATCHES,4,12/1/2010 12:15,2.55,15983.0,United Kingdom
536446,763,22152,PLACE SETTING WHITE STAR,24,12/1/2010 12:15,0.42,15983.0,United Kingdom
536446,764,85172,HYACINTH BULB T-LIGHT CANDLES,16,12/1/2010 12:15,0.42,15983.0,United Kingdom
536446,765,84754,S/15 SILVER GLASS BAUBLES IN BAG,24,12/1/2010 12:15,1.25,15983.0,United Kingdom
536460,766,22670,FRENCH WC SIGN BLUE METAL,12,12/1/2010 12:22,1.25,14849.0,United Kingdom
536460,767,21586,KINGS CHOICE GIANT TUBE MATCHES,12,12/1/2010 12:22,2.55,14849.0,United Kingdom
536460,768,84992,72 SWEETHEART FAIRY CAKE CASES,24,12/1/2010 12:22,0.55,14849.0,United Kingdom
536460,769,84879,ASSORTED COLOUR BIRD ORNAMENT,24,12/1/2010 12:22,1.69,14849.0,United Kingdom
536460,770,84849B,FAIRY SOAP SOAP HOLDER,12,12/1/2010 12:22,1.69,14849.0,United Kingdom
536460,771,22927,GREEN GIANT GARDEN THERMOMETER,2,12/1/2010 12:22,5.95,14849.0,United Kingdom
536460,772,22926,IVORY GIANT GARDEN THERMOMETER,4,12/1/2010 12:22,5.95,14849.0,United Kingdom
536460,773,22925,BLUE GIANT GARDEN THERMOMETER,2,12/1/2010 12:22,5.95,14849.0,United Kingdom
536460,774,21977,PACK OF 60 PINK PAISLEY CAKE CASES,24,12/1/2010 12:22,0.55,14849.0,United Kingdom
536460,775,21485,RETROSPOT HEART HOT WATER BOTTLE,6,12/1/2010 12:22,4.95,14849.0,United Kingdom
536460,776,21484,CHICK GREY HOT WATER BOTTLE,8,12/1/2010 12:22,3.45,14849.0,United Kingdom
536460,777,21259,VICTORIAN SEWING BOX SMALL ,2,12/1/2010 12:22,5.95,14849.0,United Kingdom
536460,778,21257,VICTORIAN SEWING BOX MEDIUM,2,12/1/2010 12:22,7.95,14849.0,United Kingdom
536460,779,21121,SET/10 RED POLKADOT PARTY CANDLES,24,12/1/2010 12:22,1.25,14849.0,United Kingdom
536463,780,82552,WASHROOM METAL SIGN,12,12/1/2010 12:22,1.45,14849.0,United Kingdom
536464,781,90200B,BLACK SWEETHEART BRACELET,2,12/1/2010 12:23,4.25,17968.0,United Kingdom
536464,782,90059B,DIAMANTE HAIR GRIP PACK/2 BLACK DIA,2,12/1/2010 12:23,1.65,17968.0,United Kingdom
536464,783,90185C,BLACK DIAMANTE EXPANDABLE RING,2,12/1/2010 12:23,4.25,17968.0,United Kingdom
536464,784,90059E,DIAMANTE HAIR GRIP PACK/2 RUBY,3,12/1/2010 12:23,1.65,17968.0,United Kingdom
536464,785,90059C,DIAMANTE HAIR GRIP PACK/2 MONTANA,1,12/1/2010 12:23,1.65,17968.0,United Kingdom
536464,786,90200C,BLUE SWEETHEART BRACELET,1,12/1/2010 12:23,4.25,17968.0,United Kingdom
536464,787,90200D,PINK SWEETHEART BRACELET,3,12/1/2010 12:23,4.25,17968.0,United Kingdom
536464,788,90200A,PURPLE SWEETHEART BRACELET,1,12/1/2010 12:23,4.25,17968.0,United Kingdom
536464,789,22386,JUMBO BAG PINK POLKADOT,1,12/1/2010 12:23,1.95,17968.0,United Kingdom
536464,790,85099B,JUMBO BAG RED RETROSPOT,1,12/1/2010 12:23,1.95,17968.0,United Kingdom
536464,791,84879,ASSORTED COLOUR BIRD ORNAMENT,8,12/1/2010 12:23,1.69,17968.0,United Kingdom
536464,792,22086,PAPER CHAIN KIT 50'S CHRISTMAS ,1,12/1/2010 12:23,2.95,17968.0,United Kingdom
536464,793,22737,RIBBON REEL CHRISTMAS PRESENT ,1,12/1/2010 12:23,1.65,17968.0,United Kingdom
536464,794,21260,FIRST AID TIN,1,12/1/2010 12:23,3.25,17968.0,United Kingdom
536464,795,22744,MAKE YOUR OWN MONSOON CARD KIT,2,12/1/2010 12:23,2.95,17968.0,United Kingdom
536464,796,21985,PACK OF 12 HEARTS DESIGN TISSUES ,1,12/1/2010 12:23,0.29,17968.0,United Kingdom
536464,797,21980,PACK OF 12 RED RETROSPOT TISSUES ,1,12/1/2010 12:23,0.29,17968.0,United Kingdom
536464,798,22988,SOLDIERS EGG CUP ,1,12/1/2010 12:23,1.25,17968.0,United Kingdom
536464,799,22297,HEART IVORY TRELLIS SMALL,1,12/1/2010 12:23,1.25,17968.0,United Kingdom
536464,800,22294,HEART FILIGREE DOVE  SMALL,1,12/1/2010 12:23,1.25,17968.0,United Kingdom
536464,801,22295,HEART FILIGREE DOVE LARGE,1,12/1/2010 12:23,1.65,17968.0,United Kingdom
536464,802,22813,PACK 3 BOXES BIRD PANNETONE ,2,12/1/2010 12:23,1.95,17968.0,United Kingdom
536464,803,22812,PACK 3 BOXES CHRISTMAS PANNETONE,6,12/1/2010 12:23,1.95,17968.0,United Kingdom
536464,804,22197,SMALL POPCORN HOLDER,5,12/1/2010 12:23,0.85,17968.0,United Kingdom
536464,805,21977,PACK OF 60 PINK PAISLEY CAKE CASES,1,12/1/2010 12:23,0.55,17968.0,United Kingdom
536464,806,22619,SET OF 6 SOLDIER SKITTLES,1,12/1/2010 12:23,3.75,17968.0,United Kingdom
536464,807,16258A,SWIRLY CIRCULAR RUBBERS IN BAG,1,12/1/2010 12:23,0.42,17968.0,United Kingdom
536464,808,21992,VINTAGE PAISLEY STATIONERY SET,1,12/1/2010 12:23,2.95,17968.0,United Kingdom
536464,809,22910,PAPER CHAIN KIT VINTAGE CHRISTMAS,1,12/1/2010 12:23,2.95,17968.0,United Kingdom
536464,810,21124,SET/10 BLUE POLKADOT PARTY CANDLES,1,12/1/2010 12:23,1.25,17968.0,United Kingdom
536464,811,22735,RIBBON REEL SOCKS AND MITTENS,2,12/1/2010 12:23,1.65,17968.0,United Kingdom
536464,812,22952,60 CAKE CASES VINTAGE CHRISTMAS,2,12/1/2010 12:23,0.55,17968.0,United Kingdom
536464,813,22945,CHRISTMAS METAL TAGS ASSORTED ,6,12/1/2010 12:23,0.85,17968.0,United Kingdom
536464,814,21816,CHRISTMAS TREE T-LIGHT HOLDER,2,12/1/2010 12:23,1.45,17968.0,United Kingdom
536464,815,21815,STAR  T-LIGHT HOLDER ,4,12/1/2010 12:23,1.45,17968.0,United Kingdom
536464,816,21814,HEART T-LIGHT HOLDER ,2,12/1/2010 12:23,1.45,17968.0,United Kingdom
536464,817,10125,MINI FUNKY DESIGN TAPES,2,12/1/2010 12:23,0.85,17968.0,United Kingdom
536464,818,22810,SET OF 6 T-LIGHTS SNOWMEN,1,12/1/2010 12:23,2.95,17968.0,United Kingdom
536464,819,22573,STAR WOODEN CHRISTMAS DECORATION,1,12/1/2010 12:23,0.85,17968.0,United Kingdom
536464,820,22577,WOODEN HEART CHRISTMAS SCANDINAVIAN,1,12/1/2010 12:23,0.85,17968.0,United Kingdom
536464,821,22603,CHRISTMAS RETROSPOT TREE WOOD,2,12/1/2010 12:23,0.85,17968.0,United Kingdom
536464,822,22809,SET OF 6 T-LIGHTS SANTA,1,12/1/2010 12:23,2.95,17968.0,United Kingdom
536464,823,20878,SET/9 CHRISTMAS T-LIGHTS SCENTED ,1,12/1/2010 12:23,1.25,17968.0,United Kingdom
536464,824,20866,BLUE ROSE FABRIC MIRROR,1,12/1/2010 12:23,1.25,17968.0,United Kingdom
536464,825,85095,THREE CANVAS LUGGAGE TAGS,1,12/1/2010 12:23,1.95,17968.0,United Kingdom
536464,826,22333,RETROSPOT PARTY BAG + STICKER SET,1,12/1/2010 12:23,1.65,17968.0,United Kingdom
536464,827,22557,PLASTERS IN TIN VINTAGE PAISLEY ,1,12/1/2010 12:23,1.65,17968.0,United Kingdom
536464,828,21584,RETROSPOT SMALL TUBE MATCHES,1,12/1/2010 12:23,1.65,17968.0,United Kingdom
536464,829,22866,HAND WARMER SCOTTY DOG DESIGN,1,12/1/2010 12:23,2.1,17968.0,United Kingdom
536464,830,22731,3D CHRISTMAS STAMPS STICKERS ,2,12/1/2010 12:23,1.25,17968.0,United Kingdom
536464,831,22866,HAND WARMER SCOTTY DOG DESIGN,1,12/1/2010 12:23,2.1,17968.0,United Kingdom
536464,832,22866,HAND WARMER SCOTTY DOG DESIGN,3,12/1/2010 12:23,2.1,17968.0,United Kingdom
536464,833,22558,CLOTHES PEGS RETROSPOT PACK 24 ,2,12/1/2010 12:23,1.49,17968.0,United Kingdom
536464,834,22956,36 FOIL HEART CAKE CASES,1,12/1/2010 12:23,2.1,17968.0,United Kingdom
536464,835,22945,CHRISTMAS METAL TAGS ASSORTED ,6,12/1/2010 12:23,0.85,17968.0,United Kingdom
536464,836,22582,PACK OF 6 SWEETIE GIFT BOXES,1,12/1/2010 12:23,2.55,17968.0,United Kingdom
536464,837,21212,PACK OF 72 RETROSPOT CAKE CASES,1,12/1/2010 12:23,0.55,17968.0,United Kingdom
536464,838,21212,PACK OF 72 RETROSPOT CAKE CASES,2,12/1/2010 12:23,0.55,17968.0,United Kingdom
536464,839,22585,PACK OF 6 BIRDY GIFT TAGS,3,12/1/2010 12:23,1.25,17968.0,United Kingdom
536464,840,21121,SET/10 RED POLKADOT PARTY CANDLES,1,12/1/2010 12:23,1.25,17968.0,United Kingdom
536464,841,21122,SET/10 PINK POLKADOT PARTY CANDLES,1,12/1/2010 12:23,1.25,17968.0,United Kingdom
536464,842,22759,SET OF 3 NOTEBOOKS IN PARCEL,1,12/1/2010 12:23,1.65,17968.0,United Kingdom
536464,843,21815,STAR  T-LIGHT HOLDER ,1,12/1/2010 12:23,1.45,17968.0,United Kingdom
536464,844,85231B,CINAMMON SET OF 9 T-LIGHTS,3,12/1/2010 12:23,0.85,17968.0,United Kingdom
536464,845,85231G,ORANGE SCENTED SET/9 T-LIGHTS,5,12/1/2010 12:23,0.85,17968.0,United Kingdom
536464,846,22082,RIBBON REEL STRIPES DESIGN ,5,12/1/2010 12:23,1.65,17968.0,United Kingdom
536464,847,22500,SET OF 2 TINS JARDIN DE PROVENCE,2,12/1/2010 12:23,4.95,17968.0,United Kingdom
536464,848,22742,MAKE YOUR OWN PLAYTIME CARD KIT,1,12/1/2010 12:23,2.95,17968.0,United Kingdom
536464,849,21329,DINOSAURS  WRITING SET ,1,12/1/2010 12:23,1.65,17968.0,United Kingdom
536464,850,21328,BALLOONS  WRITING SET ,1,12/1/2010 12:23,1.65,17968.0,United Kingdom
536464,851,21327,SKULLS WRITING SET ,1,12/1/2010 12:23,1.65,17968.0,United Kingdom
536464,852,21992,VINTAGE PAISLEY STATIONERY SET,1,12/1/2010 12:23,2.95,17968.0,United Kingdom
536464,853,21738,COSY SLIPPER SHOES SMALL  RED ,1,12/1/2010 12:23,2.95,17968.0,United Kingdom
